id_batalha,data,tempo_de_batalha,torres_derrubadas_jogador1,torres_derrubadas_jogador2,vencedor,deck_jogador1,deck_jogador2,trofeus_jogador1,trofeus_jogador2
413,2023-06-17 19:19:46.414861,3.96,1,0,Player0431,"Canhão, Golem, Torre de Bombas, Dragão Bebê, Lápide, Gigante, Relâmpago, Torre Inferno","Gigante, Dragão Bebê, Bárbaros, Corredor, Tornado, Zap, Cabana de Bárbaros, Executor",3739,3851
414,2023-06-20 04:49:54.107758,2.21,3,1,Player0095,"Bárbaros, Cabana de Goblins, Tornado, Cabana de Bárbaros, Descarga, Zap, Mago de Gelo, P.E.K.K.A","Dragão Bebê, Mago, Mosqueteira, Zap, Bárbaros, Cabana de Bárbaros, P.E.K.K.A, Cabana de Goblins",5180,3506
415,2023-05-21 01:06:42.561081,3.66,1,2,Player0303,"Coletor de Elixir, Corredor, Lápide, Mega Servo, Relâmpago, Veneno, Golem, Bárbaros","Gigante, Tornado, Fúria, Fornalha, P.E.K.K.A, Torre Inferno, Veneno, Bruxa",4843,2194
416,2023-05-25 01:09:40.023571,3.38,1,1,Player0931,"Arqueiras, Príncipe, Cabana de Goblins, Dragão Bebê, Zap, Gigante, Canhão, Bárbaros","Corredor, Fúria, Bárbaros, Mini P.E.K.K.A, Executor, Bola de Fogo, Príncipe, Golem",3730,2900
417,2023-01-31 11:31:12.003146,4.33,2,3,Player0121,"Mega Servo, Zap, Torre de Bombas, Bola de Fogo, Mini P.E.K.K.A, Fúria, Descarga, Veneno","Cavaleiro, Coletor de Elixir, Mega Servo, Bola de Fogo, Torre Inferno, Executor, Arqueiras, Relâmpago",3952,3782
418,2023-10-23 14:02:15.762914,1.75,1,2,Player0162,"Torre de Bombas, Dragão Bebê, Príncipe, Cabana de Goblins, Gigante, Mega Servo, Mago de Gelo, Mosqueteira","P.E.K.K.A, Mosqueteira, Tornado, Dragão Bebê, Bárbaros, Relâmpago, Gigante, Fúria",5683,5910
419,2023-09-12 19:49:04.162666,3.3,2,1,Player0772,"Bruxa, Mosqueteira, Mini P.E.K.K.A, Coletor de Elixir, Torre de Bombas, Zap, Bárbaros, Mega Servo","Cabana de Bárbaros, Coletor de Elixir, Lápide, Bruxa, P.E.K.K.A, Veneno, Cavaleiro, Canhão",4361,2463
420,2023-10-28 05:42:39.433196,4.71,1,1,Player0368,"P.E.K.K.A, Gigante, Bruxa, Canhão, Tornado, Cabana de Goblins, Fornalha, Executor","Mago, Descarga, Cabana de Bárbaros, Canhão, Torre Inferno, Relâmpago, Tornado, Príncipe",3596,3659
421,2023-02-12 05:12:15.661639,1.58,2,1,Player0637,"Bruxa, Mago de Gelo, Cabana de Goblins, Veneno, Gigante, Cabana de Bárbaros, Zap, Mini P.E.K.K.A","Veneno, Mini P.E.K.K.A, Príncipe, Relâmpago, Corredor, Fornalha, Fúria, Coletor de Elixir",3314,2309
422,2023-05-28 06:01:24.710520,1.93,2,1,Player0042,"Mago, Cavaleiro, Mago de Gelo, Arqueiras, Dragão Bebê, Relâmpago, Executor, Cabana de Goblins","Executor, Bruxa, Mega Servo, Torre de Bombas, Fornalha, P.E.K.K.A, Mosqueteira, Bola de Fogo",5586,4400
423,2023-01-27 01:04:52.939133,1.57,2,2,Player0821,"Fúria, Fornalha, Mega Servo, Cabana de Bárbaros, Bárbaros, Mini P.E.K.K.A, Torre de Bombas, Zap","Bruxa, Corredor, Bárbaros, Mago de Gelo, Tornado, P.E.K.K.A, Dragão Bebê, Bola de Fogo",2036,3308
424,2023-07-28 10:23:18.045576,2.14,3,2,Player0548,"Mega Servo, Corredor, P.E.K.K.A, Torre de Bombas, Executor, Mosqueteira, Dragão Bebê, Torre Inferno","Mini P.E.K.K.A, P.E.K.K.A, Executor, Golem, Torre de Bombas, Dragão Bebê, Fúria, Torre Inferno",2599,2973
425,2023-02-05 06:30:29.566759,3.38,1,2,Player0293,"Fúria, Mosqueteira, Lápide, Tornado, Cavaleiro, Torre Inferno, Cabana de Goblins, Mago de Gelo","Fúria, Bárbaros, Torre de Bombas, Fornalha, Canhão, Coletor de Elixir, Cabana de Goblins, Descarga",4650,2544
426,2023-02-21 22:24:52.478092,3.76,1,2,Player0081,"Mini P.E.K.K.A, P.E.K.K.A, Executor, Golem, Torre de Bombas, Dragão Bebê, Fúria, Torre Inferno","Mini P.E.K.K.A, Cabana de Bárbaros, Dragão Bebê, Fornalha, Mago de Gelo, Gigante, Coletor de Elixir, Mago",2973,3096
427,2023-10-07 03:11:05.242088,1.57,3,1,Player0857,"Descarga, Bruxa, Bárbaros, Príncipe, Fúria, Relâmpago, Torre de Bombas, Gigante","Príncipe, Mini P.E.K.K.A, Cavaleiro, Dragão Bebê, Arqueiras, Tornado, Descarga, Golem",3638,4591
428,2023-07-17 05:59:32.091577,3.53,0,3,Player0740,"Bárbaros, Cabana de Bárbaros, Relâmpago, Mosqueteira, Dragão Bebê, Mago de Gelo, Tornado, Bola de Fogo","Cabana de Goblins, Bruxa, Príncipe, Bola de Fogo, Corredor, Torre Inferno, Relâmpago, Mini P.E.K.K.A",5862,3861
429,2023-03-08 13:37:13.298152,3.67,2,1,Player0786,"Fúria, Fornalha, Mega Servo, Cabana de Bárbaros, Bárbaros, Mini P.E.K.K.A, Torre de Bombas, Zap","Relâmpago, Príncipe, Torre Inferno, Bárbaros, Mago, Mosqueteira, Descarga, Mago de Gelo",2036,5811
430,2023-12-31 04:59:23.246278,4.83,2,1,Player0043,"Torre de Bombas, Príncipe, Bruxa, Veneno, Fúria, Corredor, Mini P.E.K.K.A, Cabana de Goblins","Relâmpago, Fúria, Arqueiras, Golem, Gigante, Bola de Fogo, Lápide, Cabana de Goblins",4996,2544
431,2023-12-15 22:45:01.346774,3.98,1,3,Player0859,"Príncipe, Cavaleiro, Cabana de Goblins, Torre Inferno, Veneno, Descarga, Tornado, Mago de Gelo","Dragão Bebê, Bárbaros, Fornalha, Cavaleiro, Corredor, Bola de Fogo, Gigante, Executor",5545,2274
432,2023-02-02 19:40:36.797372,4.57,0,3,Player0143,"Lápide, Príncipe, Mago de Gelo, Mosqueteira, Mini P.E.K.K.A, Coletor de Elixir, Tornado, Descarga","Mega Servo, Fúria, Mosqueteira, Arqueiras, Cabana de Bárbaros, Mago de Gelo, Descarga, Dragão Bebê",2748,4380
433,2023-04-10 02:24:34.403176,2.08,2,2,Player0115,"Príncipe, Cabana de Bárbaros, Arqueiras, Gigante, Cabana de Goblins, Tornado, Coletor de Elixir, Canhão","Descarga, Gigante, Corredor, Executor, Mago de Gelo, Coletor de Elixir, Tornado, Fúria",4334,3464
434,2023-06-26 12:05:28.687528,1.97,2,1,Player0785,"Arqueiras, Tornado, Descarga, Mago de Gelo, Canhão, Mago, Cavaleiro, Cabana de Bárbaros","Mega Servo, Fornalha, Cavaleiro, Torre Inferno, Relâmpago, Descarga, Bruxa, Canhão",5224,4427
435,2023-03-27 16:13:36.722509,4.57,2,3,Player0888,"Golem, Lápide, Cabana de Goblins, Torre de Bombas, Relâmpago, Mini P.E.K.K.A, Cabana de Bárbaros, Mega Servo","Mago, Príncipe, Lápide, Gigante, Cabana de Goblins, Relâmpago, Arqueiras, Mega Servo",5036,2196
436,2023-12-30 21:31:33.732393,1.83,3,0,Player0250,"Descarga, Mega Servo, Lápide, Cabana de Goblins, Príncipe, Gigante, Dragão Bebê, Relâmpago","Torre Inferno, Bárbaros, Zap, Dragão Bebê, Bola de Fogo, Gigante, Descarga, Fornalha",4441,4630
437,2023-02-04 10:19:23.978255,4.04,2,2,Player0893,"Coletor de Elixir, Mago, Zap, Golem, Mega Servo, Corredor, Fornalha, Bola de Fogo","Mega Servo, Dragão Bebê, Mosqueteira, Gigante, P.E.K.K.A, Golem, Coletor de Elixir, Canhão",5614,2168
438,2023-06-12 17:07:04.390611,3.71,2,1,Player0780,"Golem, Torre Inferno, Mosqueteira, Tornado, Mini P.E.K.K.A, Descarga, Fornalha, Relâmpago","Mago, Mini P.E.K.K.A, Gigante, Cabana de Bárbaros, Lápide, Bárbaros, Cabana de Goblins, Tornado",4828,4036
439,2023-12-27 20:12:59.352612,1.76,1,2,Player0626,"Cabana de Bárbaros, Corredor, Fúria, Coletor de Elixir, Descarga, Mega Servo, Canhão, Tornado","Cabana de Goblins, Príncipe, Relâmpago, Mini P.E.K.K.A, Dragão Bebê, Fúria, Bruxa, Torre Inferno",2033,5815
440,2023-12-24 06:01:49.650081,2.77,3,0,Player0849,"Mosqueteira, Fornalha, Cabana de Bárbaros, Canhão, Veneno, Dragão Bebê, Coletor de Elixir, Executor","Arqueiras, Canhão, Bárbaros, Cavaleiro, Mini P.E.K.K.A, Cabana de Bárbaros, Bruxa, Tornado",4741,5941
441,2023-10-10 13:02:43.514710,1.67,2,1,Player0453,"Veneno, Relâmpago, Arqueiras, Gigante, Mini P.E.K.K.A, Cavaleiro, Mosqueteira, Executor","Lápide, Cabana de Goblins, Fúria, Mosqueteira, Torre de Bombas, Gigante, Arqueiras, Fornalha",2084,4247
442,2023-02-17 02:42:33.077103,3.12,1,2,Player0440,"Mago, Tornado, Coletor de Elixir, Cabana de Goblins, Mega Servo, Cabana de Bárbaros, Mini P.E.K.K.A, Bruxa","Mini P.E.K.K.A, Fornalha, P.E.K.K.A, Gigante, Cavaleiro, Veneno, Mega Servo, Bola de Fogo",3017,5851
443,2023-05-20 01:46:11.323846,1.82,1,3,Player0415,"Lápide, Fornalha, Príncipe, Torre Inferno, Relâmpago, Coletor de Elixir, Zap, Mini P.E.K.K.A","Mago de Gelo, Fúria, Gigante, Mega Servo, Mago, Executor, Torre Inferno, Golem",4323,2243
444,2023-06-09 15:23:49.889066,2.38,0,2,Player0503,"Canhão, Corredor, Gigante, Príncipe, Mosqueteira, Mega Servo, Bola de Fogo, Tornado","Corredor, Príncipe, Descarga, Mago, Torre Inferno, Zap, Arqueiras, Mosqueteira",4959,3335
445,2023-05-08 14:30:40.611514,3.04,1,2,Player0824,"P.E.K.K.A, Mosqueteira, Tornado, Dragão Bebê, Bárbaros, Relâmpago, Gigante, Fúria","Tornado, Bola de Fogo, Arqueiras, Cavaleiro, Mega Servo, Príncipe, Fornalha, Torre de Bombas",5910,4440
446,2023-05-24 14:56:28.841221,2.22,2,1,Player0661,"Dragão Bebê, Cavaleiro, P.E.K.K.A, Príncipe, Veneno, Descarga, Lápide, Bárbaros","Príncipe, Bruxa, Arqueiras, Relâmpago, Lápide, P.E.K.K.A, Bola de Fogo, Gigante",4367,4951
447,2023-05-07 05:03:58.440921,3.95,1,2,Player0046,"Dragão Bebê, P.E.K.K.A, Mini P.E.K.K.A, Arqueiras, Mosqueteira, Fúria, Executor, Torre Inferno","Canhão, Descarga, Veneno, Dragão Bebê, Mago, Coletor de Elixir, Cabana de Bárbaros, Bruxa",4348,3409
448,2023-05-20 17:17:56.941282,2.11,2,1,Player0713,"Torre Inferno, Fornalha, Cabana de Bárbaros, Mosqueteira, Arqueiras, Torre de Bombas, Príncipe, Zap","Fúria, Tornado, Bola de Fogo, Torre de Bombas, Cabana de Goblins, Corredor, Mini P.E.K.K.A, Cabana de Bárbaros",4823,2731
449,2023-11-15 09:33:25.272939,1.94,1,0,Player0378,"Corredor, Mago, Executor, Fúria, Bruxa, Gigante, Canhão, Dragão Bebê","Bruxa, Torre de Bombas, Mago, Príncipe, Executor, Bola de Fogo, P.E.K.K.A, Golem",3327,4658
450,2023-10-03 01:37:56.070628,4.61,2,2,Player0642,"Bárbaros, Lápide, Dragão Bebê, Zap, Cabana de Bárbaros, Arqueiras, Golem, Torre de Bombas","Golem, Torre Inferno, Mosqueteira, Tornado, Mini P.E.K.K.A, Descarga, Fornalha, Relâmpago",5480,4828
451,2023-01-17 22:26:38.100637,3.04,2,2,Player0723,"Canhão, Mago de Gelo, Lápide, Cavaleiro, Dragão Bebê, Cabana de Goblins, Bárbaros, Bola de Fogo","Golem, Zap, Mago, Cabana de Goblins, Corredor, Gigante, Veneno, Príncipe",4349,3414
452,2023-04-04 16:26:17.682890,2.17,1,0,Player0019,"Bruxa, Coletor de Elixir, Fornalha, P.E.K.K.A, Mini P.E.K.K.A, Cabana de Goblins, Lápide, Mosqueteira","Lápide, Fúria, Mago de Gelo, Corredor, Torre Inferno, Canhão, Fornalha, Torre de Bombas",3294,3858
453,2023-10-05 07:52:57.803820,2.44,2,2,Player0527,"Príncipe, Cabana de Goblins, Bruxa, P.E.K.K.A, Cavaleiro, Veneno, Descarga, Fornalha","Canhão, Descarga, Cavaleiro, Dragão Bebê, Cabana de Bárbaros, Torre Inferno, P.E.K.K.A, Bruxa",5054,4183
454,2023-10-21 13:53:15.349969,1.83,2,2,Player0980,"Fornalha, Fúria, Bruxa, Tornado, Coletor de Elixir, Bola de Fogo, Dragão Bebê, Mago de Gelo","Lápide, Mini P.E.K.K.A, Fornalha, Gigante, Tornado, Mago de Gelo, Cabana de Goblins, Torre Inferno",3507,4722
455,2023-02-08 10:36:07.356249,1.6,1,2,Player0502,"Golem, Executor, Bola de Fogo, Torre Inferno, Bruxa, Fúria, Coletor de Elixir, Arqueiras","Mega Servo, Bárbaros, Príncipe, Tornado, Fornalha, Canhão, Fúria, Mini P.E.K.K.A",4459,2154
456,2023-03-28 13:48:28.011696,3.52,1,2,Player0704,"Bruxa, Mago, Relâmpago, Cabana de Goblins, Torre Inferno, Torre de Bombas, Descarga, Coletor de Elixir","Mini P.E.K.K.A, Executor, Canhão, Bola de Fogo, Torre de Bombas, Lápide, Veneno, Corredor",2446,3600
457,2023-12-29 15:02:08.785646,3.58,1,2,Player0898,"Cabana de Goblins, Mago de Gelo, Mega Servo, Bola de Fogo, Gigante, Mago, Corredor, Fúria","Torre de Bombas, Mago de Gelo, Executor, Cavaleiro, Coletor de Elixir, Fúria, Príncipe, Relâmpago",5785,3424
458,2023-11-29 16:01:13.338941,3.35,3,2,Player0013,"Mini P.E.K.K.A, Tornado, Corredor, Bruxa, Coletor de Elixir, Bárbaros, P.E.K.K.A, Arqueiras","Relâmpago, Corredor, Zap, Fúria, Mago de Gelo, Mago, Dragão Bebê, Torre de Bombas",5961,3127
459,2023-04-08 04:54:32.595415,2.32,2,1,Player0993,"Torre de Bombas, Cabana de Goblins, Bárbaros, Cavaleiro, Fornalha, Mago, Bola de Fogo, Mosqueteira","Coletor de Elixir, Mago de Gelo, Veneno, Torre de Bombas, Fúria, Príncipe, Fornalha, Bárbaros",4831,4004
460,2023-02-21 10:52:04.317266,4.11,3,2,Player0992,"Bola de Fogo, Lápide, Arqueiras, Torre de Bombas, P.E.K.K.A, Cabana de Goblins, Golem, Executor","Dragão Bebê, Bola de Fogo, Zap, Mosqueteira, Tornado, Mago de Gelo, Coletor de Elixir, Relâmpago",3987,5712
461,2023-10-17 07:38:32.766922,3.54,2,1,Player0983,"Coletor de Elixir, Fúria, Cavaleiro, Mago de Gelo, Bruxa, Lápide, Torre Inferno, Bárbaros","Mega Servo, Canhão, Torre Inferno, Descarga, Mini P.E.K.K.A, Veneno, Cabana de Bárbaros, Lápide",5545,5771
462,2023-07-28 19:43:33.194089,2.44,0,3,Player0783,"Mosqueteira, Fornalha, Cabana de Bárbaros, Canhão, Veneno, Dragão Bebê, Coletor de Elixir, Executor","Mosqueteira, Mini P.E.K.K.A, Lápide, Golem, Cabana de Bárbaros, Cabana de Goblins, Coletor de Elixir, Mago",4741,3774
463,2023-01-18 09:07:37.488752,2.01,1,0,Player0282,"P.E.K.K.A, Mago de Gelo, Canhão, Mago, Bárbaros, Mosqueteira, Cabana de Goblins, Cabana de Bárbaros","Cabana de Bárbaros, Torre de Bombas, Mago, Golem, Mini P.E.K.K.A, Relâmpago, Canhão, Bárbaros",3533,2304
464,2023-05-26 17:01:38.032711,1.89,2,3,Player0038,"Gigante, Corredor, Mega Servo, Fúria, P.E.K.K.A, Cavaleiro, Lápide, Cabana de Goblins","Tornado, Cabana de Goblins, Golem, Dragão Bebê, Príncipe, Zap, Arqueiras, Cavaleiro",5339,2204
465,2023-01-18 00:50:57.662936,1.78,2,3,Player0308,"Mosqueteira, Gigante, Executor, Descarga, Veneno, Príncipe, Lápide, Dragão Bebê","Bola de Fogo, Veneno, Golem, Descarga, Executor, Lápide, Príncipe, Gigante",5847,3066
466,2023-03-05 11:12:26.882974,3.48,2,3,Player0012,"Fúria, Coletor de Elixir, Bruxa, Executor, Fornalha, Cabana de Bárbaros, Relâmpago, Cavaleiro","Tornado, Bruxa, Torre de Bombas, Mago de Gelo, Fornalha, Canhão, Golem, Bárbaros",5630,4876
467,2023-11-06 10:41:09.159870,2.29,2,1,Player0339,"Torre de Bombas, P.E.K.K.A, Descarga, Golem, Mini P.E.K.K.A, Veneno, Zap, Mago","Cabana de Goblins, Mega Servo, Dragão Bebê, Canhão, Bruxa, P.E.K.K.A, Arqueiras, Gigante",3308,4751
468,2023-09-17 23:34:08.311166,4.37,1,2,Player0418,"Torre de Bombas, Cabana de Goblins, Mago de Gelo, Golem, Canhão, Cavaleiro, Bruxa, Torre Inferno","Mini P.E.K.K.A, Torre de Bombas, Canhão, Lápide, Fornalha, Relâmpago, Bárbaros, Bruxa",2965,2679
469,2023-01-05 03:07:12.749978,1.79,2,2,Player0549,"Golem, Torre de Bombas, Canhão, Cabana de Goblins, Príncipe, Tornado, Lápide, Veneno","Mago de Gelo, Mago, Torre Inferno, P.E.K.K.A, Cavaleiro, Lápide, Mega Servo, Mosqueteira",2648,4203
470,2023-10-16 19:59:05.763626,2.1,2,2,Player0494,"Dragão Bebê, Bola de Fogo, Mega Servo, Bruxa, Mago, Gigante, Cavaleiro, Relâmpago","Mega Servo, Coletor de Elixir, Cabana de Bárbaros, Fúria, Tornado, Lápide, Zap, Cavaleiro",5810,2949
471,2023-05-13 15:33:20.805656,1.87,1,2,Player0075,"Tornado, Mosqueteira, Mini P.E.K.K.A, Coletor de Elixir, Dragão Bebê, Fornalha, Torre Inferno, Bruxa","Príncipe, Canhão, Cabana de Goblins, Mega Servo, Mago, Tornado, Zap, Torre Inferno",3642,5142
472,2023-01-24 05:23:45.945199,4.31,2,1,Player0077,"Arqueiras, Corredor, Fúria, Canhão, Mini P.E.K.K.A, Cavaleiro, Mago de Gelo, Bárbaros","Golem, Arqueiras, Relâmpago, Veneno, P.E.K.K.A, Descarga, Torre Inferno, Corredor",4555,3157
473,2023-06-22 13:20:22.924461,4.81,1,1,Player0153,"Cabana de Bárbaros, Veneno, Mago, Torre Inferno, Gigante, Corredor, Bárbaros, Lápide","Zap, Relâmpago, Dragão Bebê, Fornalha, Mega Servo, P.E.K.K.A, Gigante, Mago de Gelo",2359,5877
474,2023-09-07 00:22:10.799075,4.84,0,2,Player1000,"Lápide, Mago, Mega Servo, Executor, Bárbaros, Torre de Bombas, Descarga, Dragão Bebê","Veneno, Mini P.E.K.K.A, Coletor de Elixir, Fúria, Cabana de Bárbaros, Zap, Arqueiras, Bárbaros",5081,4503
475,2023-04-27 22:24:19.467830,1.84,1,1,Player0861,"Arqueiras, Bola de Fogo, Cabana de Goblins, Torre de Bombas, Fúria, Mosqueteira, Dragão Bebê, Cavaleiro","Golem, Torre de Bombas, P.E.K.K.A, Príncipe, Dragão Bebê, Gigante, Mosqueteira, Corredor",4155,5847
476,2023-01-15 23:02:39.863412,4.79,0,2,Player0134,"Canhão, Tornado, Mago de Gelo, Veneno, Golem, Mini P.E.K.K.A, Mosqueteira, Torre de Bombas","P.E.K.K.A, Torre de Bombas, Mago, Corredor, Tornado, Canhão, Veneno, Executor",5714,5983
477,2023-07-17 09:45:14.251976,2.38,1,2,Player0547,"Gigante, Torre Inferno, Cavaleiro, Dragão Bebê, Corredor, Príncipe, Bola de Fogo, Torre de Bombas","Descarga, Fúria, Príncipe, Arqueiras, Cabana de Bárbaros, P.E.K.K.A, Torre Inferno, Mosqueteira",5726,2772
478,2023-12-31 08:43:53.547755,4.63,3,1,Player0945,"Dragão Bebê, Fúria, Arqueiras, Zap, Torre de Bombas, Mago de Gelo, Bárbaros, Golem","Mosqueteira, Fúria, Gigante, Lápide, Cabana de Goblins, Descarga, Cavaleiro, Mega Servo",4692,2771
479,2023-10-27 04:56:54.495880,3.44,1,0,Player0592,"Corredor, Zap, Relâmpago, Gigante, Coletor de Elixir, Lápide, Mega Servo, Torre Inferno","Veneno, Mago, Golem, Bárbaros, Corredor, Fornalha, Mini P.E.K.K.A, Cabana de Goblins",4483,5404
480,2023-04-04 14:03:36.011607,4.26,1,2,Player0239,"Mosqueteira, Executor, Coletor de Elixir, Veneno, Torre de Bombas, Mini P.E.K.K.A, Cabana de Bárbaros, Bola de Fogo","Cavaleiro, Fornalha, Torre Inferno, Mago de Gelo, Zap, P.E.K.K.A, Bárbaros, Canhão",4278,4755
481,2023-12-06 01:38:33.944992,3.96,2,0,Player0937,"Cabana de Bárbaros, Cabana de Goblins, Mosqueteira, Golem, Executor, Zap, Lápide, Fornalha","Fornalha, Mosqueteira, Coletor de Elixir, Torre de Bombas, Mega Servo, Cabana de Goblins, Bárbaros, Canhão",3485,2094
482,2023-02-04 00:18:14.847827,4.11,1,0,Player0935,"Dragão Bebê, Cabana de Goblins, Mago de Gelo, Mosqueteira, Príncipe, Bruxa, Cavaleiro, Fúria","Fúria, Bola de Fogo, Mosqueteira, Mega Servo, Relâmpago, Veneno, Golem, Torre Inferno",2612,5698
483,2023-10-30 13:39:42.391775,3.78,1,1,Player0163,"Lápide, Descarga, Mega Servo, Fornalha, Arqueiras, Zap, Golem, P.E.K.K.A","Bárbaros, Cabana de Goblins, Mago, Mini P.E.K.K.A, Bruxa, Arqueiras, Mago de Gelo, Relâmpago",5829,4569
484,2023-01-19 07:43:14.409125,3.67,1,2,Player0864,"Gigante, Cavaleiro, Mago, Bola de Fogo, Lápide, Fornalha, Torre Inferno, Corredor","Cabana de Bárbaros, Dragão Bebê, Fornalha, Fúria, Bárbaros, Bola de Fogo, Veneno, Tornado",2020,2152
485,2023-05-31 17:51:19.957710,4.26,1,2,Player0401,"Bruxa, Coletor de Elixir, Dragão Bebê, Gigante, Descarga, Cavaleiro, Executor, Mini P.E.K.K.A","Coletor de Elixir, Cabana de Goblins, Torre de Bombas, Bola de Fogo, Torre Inferno, Gigante, Mago, Zap",3032,5446
486,2023-05-13 21:10:41.974768,1.6,1,2,Player0023,"Mago, Descarga, Cabana de Bárbaros, Canhão, Torre Inferno, Relâmpago, Tornado, Príncipe","Tornado, Bola de Fogo, Arqueiras, Cavaleiro, Mega Servo, Príncipe, Fornalha, Torre de Bombas",3659,4440
487,2023-05-07 02:39:43.752291,4.51,2,0,Player0703,"Relâmpago, Bola de Fogo, Mago, Arqueiras, Tornado, Descarga, Corredor, Bárbaros","Fornalha, Canhão, Tornado, Mago, Bruxa, Gigante, Bola de Fogo, Torre Inferno",5144,3223
488,2023-11-24 23:42:25.717325,2.94,1,0,Player0731,"Bola de Fogo, Mago de Gelo, Gigante, Golem, Cabana de Goblins, Zap, Descarga, Cabana de Bárbaros","Gigante, Mini P.E.K.K.A, Coletor de Elixir, Cabana de Bárbaros, Golem, Cavaleiro, Fúria, Torre de Bombas",2319,3215
489,2023-01-12 13:46:41.728992,3.06,2,1,Player0039,"Dragão Bebê, Bárbaros, Príncipe, Mago de Gelo, Cavaleiro, Zap, Cabana de Bárbaros, Descarga","Dragão Bebê, Tornado, Torre Inferno, Arqueiras, Descarga, Mago, Gigante, Fornalha",3438,4240
490,2023-04-20 06:06:00.041850,3.92,3,2,Player0163,"Lápide, Descarga, Mega Servo, Fornalha, Arqueiras, Zap, Golem, P.E.K.K.A","Torre de Bombas, P.E.K.K.A, Descarga, Golem, Mini P.E.K.K.A, Veneno, Zap, Mago",5829,3308
491,2023-03-08 00:23:21.417403,2.06,2,1,Player0831,"Canhão, Bárbaros, Dragão Bebê, Torre Inferno, Coletor de Elixir, Príncipe, P.E.K.K.A, Cavaleiro","Bola de Fogo, Tornado, Mago, Cavaleiro, Cabana de Bárbaros, Bruxa, Corredor, Golem",5581,2214
492,2023-09-01 21:03:40.833253,4.42,1,1,Player0909,"Cavaleiro, P.E.K.K.A, Príncipe, Descarga, Mosqueteira, Golem, Coletor de Elixir, Cabana de Goblins","Bola de Fogo, Cavaleiro, Mago, Dragão Bebê, Canhão, Gigante, Bárbaros, Cabana de Bárbaros",2291,3103
493,2023-10-11 18:11:23.611346,2.6,2,1,Player0910,"Coletor de Elixir, Cabana de Goblins, Bárbaros, Bruxa, Mega Servo, Cavaleiro, Mago, Lápide","Arqueiras, Fúria, Lápide, Torre de Bombas, Corredor, Bola de Fogo, Gigante, Cavaleiro",3394,5300
494,2023-10-15 02:52:45.423403,2.0,1,1,Player0041,"Golem, Torre de Bombas, Canhão, Cabana de Goblins, Príncipe, Tornado, Lápide, Veneno","Arqueiras, Mosqueteira, Coletor de Elixir, Príncipe, Gigante, Golem, Mini P.E.K.K.A, Lápide",2648,2250
495,2023-07-29 15:20:36.668358,4.29,1,1,Player0491,"Torre Inferno, Coletor de Elixir, Mago de Gelo, Tornado, Bola de Fogo, Gigante, Fornalha, Mosqueteira","Torre de Bombas, Descarga, Mosqueteira, Arqueiras, Zap, Mega Servo, Mago, Bruxa",2548,3434
496,2023-01-10 22:05:17.000542,2.26,1,1,Player0639,"Golem, Relâmpago, Descarga, Canhão, Veneno, Lápide, Bruxa, Arqueiras","Fúria, Executor, Fornalha, Torre Inferno, Bruxa, Canhão, Bola de Fogo, Descarga",2966,2115
497,2023-02-05 14:02:29.487782,1.95,1,2,Player0523,"Fúria, Cavaleiro, Fornalha, Bárbaros, Mago, Mega Servo, Cabana de Bárbaros, Arqueiras","Relâmpago, Zap, Mini P.E.K.K.A, Corredor, Cabana de Goblins, Fornalha, Arqueiras, Dragão Bebê",3288,3405
498,2023-02-02 01:16:12.603336,3.44,0,2,Player0015,"Mini P.E.K.K.A, Fornalha, P.E.K.K.A, Gigante, Cavaleiro, Veneno, Mega Servo, Bola de Fogo","Dragão Bebê, Canhão, Veneno, Cabana de Bárbaros, Lápide, Mago de Gelo, Corredor, P.E.K.K.A",5851,4840
499,2023-11-05 04:22:59.443915,1.86,2,1,Player0804,"Corredor, Veneno, Cabana de Bárbaros, Mega Servo, Coletor de Elixir, Torre Inferno, Cavaleiro, Gigante","Torre de Bombas, Cavaleiro, Tornado, Corredor, Bola de Fogo, Descarga, Arqueiras, Fúria",2624,3881
500,2023-10-09 22:06:20.953129,2.79,2,2,Player0201,"Torre de Bombas, Fúria, Bruxa, Cabana de Goblins, Veneno, Tornado, Cavaleiro, Mini P.E.K.K.A","Fornalha, Torre de Bombas, Cabana de Goblins, Mini P.E.K.K.A, Coletor de Elixir, Mago de Gelo, Torre Inferno, Bárbaros",2207,4198
501,2023-05-05 23:58:10.830963,4.73,2,3,Player0437,"Veneno, Mini P.E.K.K.A, Príncipe, Relâmpago, Corredor, Fornalha, Fúria, Coletor de Elixir","Arqueiras, Mago, Fúria, Fornalha, Tornado, Mini P.E.K.K.A, Corredor, Veneno",2309,3176
502,2023-05-08 18:12:29.249678,1.85,1,0,Player0616,"Executor, Mago de Gelo, Cabana de Goblins, Arqueiras, Golem, Corredor, Bruxa, Descarga","Bruxa, Relâmpago, Mago de Gelo, Fúria, Bárbaros, Tornado, Corredor, Arqueiras",2979,3467
503,2023-12-01 01:15:08.520218,3.74,1,2,Player0286,"Príncipe, Zap, Gigante, Executor, Lápide, Mago, Torre Inferno, Coletor de Elixir","Gigante, P.E.K.K.A, Golem, Corredor, Príncipe, Veneno, Cabana de Goblins, Coletor de Elixir",3898,2432
504,2023-10-18 14:50:42.473863,4.79,2,1,Player0011,"Torre Inferno, Cavaleiro, Relâmpago, Zap, Bárbaros, Corredor, Descarga, Lápide","Zap, Tornado, Mosqueteira, Cabana de Goblins, Príncipe, Mago de Gelo, Dragão Bebê, Lápide",4335,3613
505,2023-11-25 10:33:26.731890,3.29,3,1,Player0637,"Veneno, Mini P.E.K.K.A, Príncipe, Relâmpago, Corredor, Fornalha, Fúria, Coletor de Elixir","Executor, Canhão, Coletor de Elixir, Gigante, Fúria, Cabana de Goblins, Corredor, Cabana de Bárbaros",2309,5795
506,2023-08-06 06:42:50.827395,4.34,3,2,Player0852,"Descarga, Bárbaros, Mago, Torre Inferno, Arqueiras, Fornalha, Mini P.E.K.K.A, Corredor","Torre Inferno, Coletor de Elixir, Mago de Gelo, Tornado, Bola de Fogo, Gigante, Fornalha, Mosqueteira",5609,2548
507,2023-01-13 15:34:37.120366,2.89,2,3,Player0686,"Corredor, Fornalha, Cabana de Goblins, Torre Inferno, Bola de Fogo, Gigante, Tornado, Golem","Golem, Arqueiras, Executor, Veneno, Coletor de Elixir, Mega Servo, Lápide, Mosqueteira",3612,2573
508,2023-12-10 05:26:27.170675,2.19,0,3,Player0082,"Executor, Descarga, Mago de Gelo, Torre Inferno, Golem, P.E.K.K.A, Cabana de Goblins, Príncipe","Arqueiras, Bárbaros, Fornalha, Descarga, P.E.K.K.A, Torre Inferno, Veneno, Canhão",2871,2212
509,2023-12-08 01:36:25.963485,1.75,2,1,Player0779,"Golem, Cabana de Goblins, Corredor, Canhão, Bola de Fogo, Tornado, Coletor de Elixir, Mega Servo","Coletor de Elixir, Cabana de Bárbaros, Torre de Bombas, Bola de Fogo, Príncipe, Tornado, Cabana de Goblins, Lápide",2180,3306
510,2023-12-31 20:58:57.714532,2.39,0,1,Player0478,"Mosqueteira, Cabana de Bárbaros, Corredor, Veneno, Torre Inferno, Cabana de Goblins, Bola de Fogo, Fornalha","P.E.K.K.A, Coletor de Elixir, Relâmpago, Torre Inferno, Golem, Descarga, Dragão Bebê, Zap",4116,4269
511,2023-06-04 03:51:13.053759,4.35,2,0,Player0762,"Mago, Fúria, Relâmpago, Descarga, Fornalha, Mini P.E.K.K.A, Executor, Arqueiras","Príncipe, P.E.K.K.A, Golem, Relâmpago, Arqueiras, Zap, Bruxa, Torre de Bombas",2343,4882
512,2023-10-30 06:49:42.220169,4.4,1,1,Player0218,"Cabana de Bárbaros, P.E.K.K.A, Arqueiras, Cabana de Goblins, Golem, Príncipe, Tornado, Canhão","Cabana de Goblins, Mega Servo, Tornado, Fornalha, Mago de Gelo, Zap, Executor, Relâmpago",2321,2231
513,2023-02-14 18:32:03.540342,3.48,1,2,Player0861,"Arqueiras, Bola de Fogo, Cabana de Goblins, Torre de Bombas, Fúria, Mosqueteira, Dragão Bebê, Cavaleiro","Mago de Gelo, Dragão Bebê, Descarga, Príncipe, Cabana de Goblins, Cavaleiro, Coletor de Elixir, Tornado",4155,2783
514,2023-04-03 00:10:54.038389,4.66,1,1,Player0058,"Príncipe, Arqueiras, Fornalha, Cavaleiro, P.E.K.K.A, Bola de Fogo, Mosqueteira, Bruxa","Cavaleiro, Príncipe, Coletor de Elixir, Tornado, Mago, Zap, Fornalha, Mega Servo",5387,2717
